<?xml version="1.0" encoding="utf-8" ?>
<e:exam xmlns:e="http://ylioppilastutkinto.fi/exam.xsd" xmlns="http://www.w3.org/1999/xhtml" xmlns:xsi="http://www.w3.org/2001/XMLSchema-instance" xsi:schemaLocation="http://ylioppilastutkinto.fi/exam.xsd https://abitti.dev/schema/exam.xsd" exam-schema-version="0.1" date="2020-01-01" exam-code="A" day-code="X">
    <e:languages>
        <e:language>fi-FI</e:language>
        <e:language>sv-FI</e:language>
    </e:languages>
    <e:exam-title />
    <e:exam-instruction />
    <e:section>
        <e:section-title/>
        <e:section-instruction>Section without cas-forbidden attribute</e:section-instruction>
        <e:question>
            <e:question-title/>
        </e:question>
    </e:section>
    <e:section cas-forbidden="true">
        <e:section-title/>
        <e:section-instruction>Cas forbidden section 1</e:section-instruction>
        <e:question>
            <e:question-title/>
            <e:audio src="1.ogg">
                Audio file <em>description</em>
            </e:audio>
            <e:image src="1.jpg">
                Audio file <em>description</em>
            </e:image>
        </e:question>
    </e:section>
    <e:section cas-forbidden="true">
        <e:section-title/>
        <e:section-instruction>Cas forbidden section 2</e:section-instruction>
        <e:section-instruction>
            <p>Instructions 2</p>
        </e:section-instruction>
        <e:question>
            <e:question-title>Question with sub question</e:question-title>
            <e:question>
                <e:question-title>Sub question</e:question-title>
            </e:question>
        </e:question>
    </e:section>
    <e:section cas-forbidden="false">
        <e:section-title/>
        <e:section-instruction>Explicitly unset cas forbidden section</e:section-instruction>
        <e:question>
            <e:question-title/>
        </e:question>
    </e:section>
    <e:section cas-forbidden="true">
        <e:section-title/>
        <e:section-instruction>Cas forbidden section 3</e:section-instruction>
        <e:section-instruction>
            <p>Instructions 3</p>
        </e:section-instruction>
        <e:question>
            <e:question-title></e:question-title>
        </e:question>
    </e:section>
</e:exam>
