<?xml version="1.0" encoding="UTF-8"?>
<e:exam xmlns:e="http://ylioppilastutkinto.fi/exam.xsd" xmlns="http://www.w3.org/1999/xhtml" xmlns:xsi="http://www.w3.org/2001/XMLSchema-instance" xsi:schemaLocation="http://ylioppilastutkinto.fi/exam.xsd https://abitti.dev/schema/exam.xsd" exam-schema-version="0.5">
    <e:exam-versions>
        <e:exam-version lang="fi-FI"/>
    </e:exam-versions>
    <e:exam-title>Cas forbidden</e:exam-title>
    <e:exam-instruction/>
    <e:table-of-contents/>
    <e:section cas-forbidden="true">
        <e:section-title>First section</e:section-title>
    </e:section>
    <e:section cas-forbidden="false">
        <e:section-title>Second section</e:section-title>
    </e:section>
    <e:section>
        <e:section-title>Third section</e:section-title>
    </e:section>
</e:exam>