<?xml version="1.0" encoding="UTF-8"?>
<e:exam xmlns:e="http://ylioppilastutkinto.fi/exam.xsd" xmlns:xsi="http://www.w3.org/2001/XMLSchema-instance" xmlns="http://www.w3.org/1999/xhtml" xsi:schemaLocation="http://ylioppilastutkinto.fi/exam.xsd exam.xsd" exam-schema-version="0.3" date="2018-09-29" exam-code="FF" exam-stylesheet="custom.css">
  <e:exam-versions>
      <e:exam-version lang="fi-FI"/>
  </e:exam-versions>
  <e:exam-title>Produktiivinen aukko ilman pisteitä</e:exam-title>
  <e:section>
    <e:section-title>Ensimmäinen osa</e:section-title>
    <e:question>
      <e:question-title>Produktiivinen aukko</e:question-title>
      <e:hints>
        <e:scored-text-answer>
          <e:accepted-answer>Pisteetön vaihtoehto</e:accepted-answer>
        </e:scored-text-answer>
      </e:hints>
    </e:question>
  </e:section>
</e:exam>
