<?xml version="1.0" encoding="utf-8" ?>
<e:exam xmlns:e="http://ylioppilastutkinto.fi/exam.xsd" xmlns="http://www.w3.org/1999/xhtml" xmlns:xsi="http://www.w3.org/2001/XMLSchema-instance" xsi:schemaLocation="http://ylioppilastutkinto.fi/exam.xsd https://abitti.dev/schema/exam.xsd" exam-schema-version="0.5">
    <e:exam-versions>
        <e:exam-version lang="fi-FI" />
    </e:exam-versions>

    <e:exam-title>Exam title</e:exam-title>

    <e:exam-instruction>
        Exam instructions.
    </e:exam-instruction>

    <e:table-of-contents />

    <e:section>
        <e:section-title>Section title</e:section-title>

        <e:question>
            <e:question-title>Question title</e:question-title>
            <e:question-instruction>Question instructions</e:question-instruction>
            <e:text-answer max-score="10" type="rich-text" />
        </e:question>
    </e:section>
</e:exam>
