<?xml version="1.0" encoding="UTF-8"?>
<e:exam xmlns:e="http://ylioppilastutkinto.fi/exam.xsd" xmlns="http://www.w3.org/1999/xhtml" xmlns:xsi="http://www.w3.org/2001/XMLSchema-instance" xsi:schemaLocation="http://ylioppilastutkinto.fi/exam.xsd https://abitti.dev/schema/exam.xsd" exam-schema-version="0.5" date="2020-01-01" exam-code="A" day-code="X">
  <e:exam-versions>
    <e:exam-version lang="fi-FI"/>
    <e:exam-version lang="sv-FI"/>
  </e:exam-versions>
  <e:exam-title/>
  <e:exam-instruction/>
  <e:section>
    <e:section-title/>
    <e:question>
      <e:question-title></e:question-title>
      <e:choice-answer>
        <e:choice-answer-option>A</e:choice-answer-option>
        <e:choice-answer-option>B</e:choice-answer-option>
        <e:choice-answer-option>C</e:choice-answer-option>
        <e:choice-answer-option type="no-answer">En vastaa</e:choice-answer-option>
      </e:choice-answer>
    </e:question>
  </e:section>
</e:exam>
